,oración,similitud_coseno
0,La inteligencia artificial está transformando la industria del software.,0.9999999999999998
2,La inteligencia artificial revolucionará la asistencia médica en los próximos años.,0.3483774281692946
1,Los avances en inteligencia artificial y aprendizaje automático impulsan nuevas aplicaciones.,0.12251624289012936
4,Los goles de Lionel Messi llevaron al equipo a la victoria.,0.12108307803979913
5,Las estrategias defensivas del fútbol moderno requieren comunicación constante.,0.08472506325599218
3,El equipo de fútbol ganó el campeonato después de un partido intenso.,0.0
